{
	"$schema": "../schema/module-schema.json",
	"title": "Margin",
	"name": "margin",
	"initialOpen": true,
	"supports": [{
			"name": "xd/margin",
			"attributes": {
				"marginTop": {
					"type": "string",
					"default": "xd-mt--lg",
					"className": true
				},
				"marginBottom": {
					"type": "string",
					"default": "xd-mb--lg",
					"className": true
				}
			}
		},
		{
			"name": "xd/margin-controls",
			"inspectorControls": [{
					"type": "XDRadioButtonGroup",
					"label": "Top",
					"attribute": "marginTop",
					"options": [{
							"label": "None",
							"value": ""
						},
						{
							"label": "Small",
							"value": "xd-mt--sm"
						},
						{
							"label": "Large",
							"value": "xd-mt--lg"
						}
					]
				},
				{
					"type": "XDRadioButtonGroup",
					"label": "Bottom",
					"attribute": "marginBottom",
					"options": [{
							"label": "None",
							"value": ""
						},
						{
							"label": "Small",
							"value": "xd-mb--sm"
						},
						{
							"label": "Large",
							"value": "xd-mb--lg"
						}
					]
				}
			]
		}
	]
}